{
  "$schema": "https://json-schema.org/draft/2020-12/schema",
  "$id": "urn:aibridge:contracts:v1:rule",
  "title": "Rule",
  "description": "@generated by scripts/generate-contracts.ts from src/orchestration/schemas.ts:467 (export ruleSchema). DO NOT EDIT. Invariants from .refine()/.superRefine() are NOT representable in JSON Schema and are absent from this file; they remain enforced by the TypeScript engine, which is the sole authority for them (ADR 0008 §2.2 Tier 2).",
  "type": "object",
  "properties": {
    "schemaVersion": {
      "anyOf": [
        {
          "type": "number",
          "const": 1,
          "title": "RuleSchemaVersion0"
        },
        {
          "type": "number",
          "const": 2,
          "title": "RuleSchemaVersion1"
        }
      ]
    },
    "ruleId": {
      "type": "string",
      "pattern": "^[A-Za-z0-9][A-Za-z0-9._:-]{0,127}$",
      "title": "RuleRuleId"
    },
    "templateVersion": {
      "type": "integer",
      "exclusiveMinimum": 0,
      "maximum": 9007199254740991,
      "title": "RuleTemplateVersion"
    },
    "projectId": {
      "type": "string",
      "pattern": "^[A-Za-z0-9][A-Za-z0-9._:-]{0,127}$",
      "title": "RuleProjectId"
    },
    "enabled": {
      "type": "boolean"
    },
    "match": {
      "type": "object",
      "properties": {
        "taskTitlePattern": {
          "type": "string",
          "minLength": 1,
          "maxLength": 256,
          "title": "RuleMatchTaskTitlePattern"
        },
        "requestedCapabilitiesAny": {
          "maxItems": 128,
          "type": "array",
          "items": {
            "type": "string",
            "pattern": "^[A-Za-z0-9][A-Za-z0-9._:-]{0,127}$",
            "title": "RuleMatchRequestedCapabilitiesAny"
          },
          "title": "RuleMatchRequestedCapabilitiesAny"
        },
        "runtimeKinds": {
          "maxItems": 128,
          "type": "array",
          "items": {
            "type": "string",
            "pattern": "^[A-Za-z0-9][A-Za-z0-9._:-]{0,127}$",
            "title": "RuleMatchRuntimeKinds"
          },
          "title": "RuleMatchRuntimeKinds"
        }
      },
      "additionalProperties": false
    },
    "effect": {
      "oneOf": [
        {
          "type": "object",
          "properties": {
            "kind": {
              "type": "string",
              "const": "restrict",
              "title": "RuleEffect0Kind"
            },
            "deniedCapabilities": {
              "maxItems": 128,
              "type": "array",
              "items": {
                "type": "string",
                "pattern": "^[A-Za-z0-9][A-Za-z0-9._:-]{0,127}$",
                "title": "RuleEffect0DeniedCapabilities"
              },
              "title": "RuleEffect0DeniedCapabilities"
            },
            "requireApprovalForDestructiveEffects": {
              "type": "boolean"
            },
            "requireApprovalForExternalEffects": {
              "type": "boolean"
            }
          },
          "required": [
            "kind",
            "deniedCapabilities",
            "requireApprovalForDestructiveEffects",
            "requireApprovalForExternalEffects"
          ],
          "additionalProperties": false,
          "title": "RuleEffect0"
        },
        {
          "type": "object",
          "properties": {
            "kind": {
              "type": "string",
              "const": "pre_approve",
              "title": "RuleEffect1Kind"
            },
            "approvedCapabilities": {
              "minItems": 1,
              "maxItems": 128,
              "type": "array",
              "items": {
                "type": "string",
                "pattern": "^[A-Za-z0-9][A-Za-z0-9._:-]{0,127}$",
                "title": "RuleEffect1ApprovedCapabilities"
              },
              "title": "RuleEffect1ApprovedCapabilities"
            },
            "maximumTimeoutSeconds": {
              "type": "integer",
              "exclusiveMinimum": 0,
              "maximum": 9007199254740991,
              "title": "RuleEffect1MaximumTimeoutSeconds"
            },
            "allowDestructiveEffects": {
              "type": "boolean"
            },
            "allowExternalEffects": {
              "type": "boolean"
            }
          },
          "required": [
            "kind",
            "approvedCapabilities",
            "maximumTimeoutSeconds",
            "allowDestructiveEffects",
            "allowExternalEffects"
          ],
          "additionalProperties": false,
          "title": "RuleEffect1"
        }
      ]
    },
    "author": {
      "oneOf": [
        {
          "type": "object",
          "properties": {
            "kind": {
              "type": "string",
              "const": "user",
              "title": "RuleAuthor0Kind"
            },
            "userId": {
              "type": "string",
              "pattern": "^[A-Za-z0-9][A-Za-z0-9._:-]{0,127}$",
              "title": "RuleAuthor0UserId"
            }
          },
          "required": [
            "kind",
            "userId"
          ],
          "additionalProperties": false,
          "title": "RuleAuthor0"
        },
        {
          "type": "object",
          "properties": {
            "kind": {
              "type": "string",
              "const": "node",
              "title": "RuleAuthor1Kind"
            },
            "nodeId": {
              "type": "string",
              "pattern": "^[A-Za-z0-9][A-Za-z0-9._:-]{0,127}$",
              "title": "RuleAuthor1NodeId"
            }
          },
          "required": [
            "kind",
            "nodeId"
          ],
          "additionalProperties": false,
          "title": "RuleAuthor1"
        },
        {
          "type": "object",
          "properties": {
            "kind": {
              "type": "string",
              "const": "session",
              "title": "RuleAuthor2Kind"
            },
            "sessionId": {
              "type": "string",
              "pattern": "^[A-Za-z0-9][A-Za-z0-9._:-]{0,127}$",
              "title": "RuleAuthor2SessionId"
            }
          },
          "required": [
            "kind",
            "sessionId"
          ],
          "additionalProperties": false,
          "title": "RuleAuthor2"
        },
        {
          "type": "object",
          "properties": {
            "kind": {
              "type": "string",
              "const": "system",
              "title": "RuleAuthor3Kind"
            },
            "name": {
              "type": "string",
              "minLength": 1,
              "maxLength": 256,
              "title": "RuleAuthor3Name"
            }
          },
          "required": [
            "kind",
            "name"
          ],
          "additionalProperties": false,
          "title": "RuleAuthor3"
        }
      ]
    },
    "createdAt": {
      "type": "string",
      "pattern": "^\\d{4}-\\d{2}-\\d{2}T\\d{2}:\\d{2}:\\d{2}(?:\\.\\d{1,9})?Z$",
      "title": "RuleCreatedAt"
    }
  },
  "required": [
    "schemaVersion",
    "ruleId",
    "templateVersion",
    "projectId",
    "enabled",
    "match",
    "effect",
    "author",
    "createdAt"
  ],
  "additionalProperties": false
}
