{
  "schemaVersion": 1,
  "ruleId": "rule-contract",
  "templateVersion": 1,
  "projectId": "project-contract",
  "enabled": true,
  "match": { "requestedCapabilitiesAny": ["read"] },
  "effect": {
    "kind": "restrict",
    "deniedCapabilities": ["write"],
    "requireApprovalForDestructiveEffects": true,
    "requireApprovalForExternalEffects": true
  },
  "author": { "kind": "user", "userId": "user-contract" },
  "createdAt": "2026-09-17T00:00:00.000Z"
}
